{
  "schemaVersion": "1.0.0",
  "generatedAt": "2026-09-11T15:49:52.352Z",
  "projectUnderstanding": {
    "json": "reports/project-understanding.json",
    "jsonSha256": "c7c5a7e9c928fe297a8dd4dabac19fbd85a569e50a875ea65661fbc0d5e6c2f2",
    "markdown": "reports/project-understanding.md",
    "markdownSha256": "15621cd2f3f4df019c5b8d8098acedde7363b6947edeafc87be5ded5a9c518cf"
  },
  "guide": "docs/PROJECT-GUIDE.md",
  "guideSha256": "e60061bcd66df3fbba4831fe0391f40556d88e67208b2b631c29f6e1449fd4ef",
  "claims": [
    {
      "id": "claim-01-azure",
      "topic": "project-understanding",
      "status": "verified",
      "statement": "Top-level project boundary containing 1 scanned files.",
      "evidence": [
        ".azure/environment.json"
      ]
    },
    {
      "id": "claim-02-github",
      "topic": "project-understanding",
      "status": "verified",
      "statement": "Top-level project boundary containing 73 scanned files.",
      "evidence": [
        ".github/copilot-instructions.md"
      ]
    },
    {
      "id": "claim-03-vscode",
      "topic": "project-understanding",
      "status": "verified",
      "statement": "Top-level project boundary containing 2 scanned files.",
      "evidence": [
        ".vscode/extensions.json"
      ]
    },
    {
      "id": "claim-04-demo",
      "topic": "project-understanding",
      "status": "verified",
      "statement": "Top-level project boundary containing 15 scanned files.",
      "evidence": [
        "Demo/audio/narration/scene-01.mp3"
      ]
    },
    {
      "id": "claim-05-config",
      "topic": "project-understanding",
      "status": "verified",
      "statement": "Top-level project boundary containing 4 scanned files.",
      "evidence": [
        "config/gitleaks-allowlist.json"
      ]
    },
    {
      "id": "claim-06-docs",
      "topic": "project-understanding",
      "status": "verified",
      "statement": "Top-level project boundary containing 5 scanned files.",
      "evidence": [
        "docs/INTERNAL-RELEASE.md"
      ]
    },
    {
      "id": "claim-07-release",
      "topic": "project-understanding",
      "status": "verified",
      "statement": "Top-level project boundary containing 1 scanned files.",
      "evidence": [
        "release/release-manifest.json"
      ]
    },
    {
      "id": "claim-08-reports",
      "topic": "project-understanding",
      "status": "verified",
      "statement": "Top-level project boundary containing 80 scanned files.",
      "evidence": [
        "reports/adoption-rerun-evidence.json"
      ]
    },
    {
      "id": "claim-09-schemas",
      "topic": "project-understanding",
      "status": "verified",
      "statement": "Top-level project boundary containing 45 scanned files.",
      "evidence": [
        "schemas/adoption-transaction.schema.json"
      ]
    },
    {
      "id": "claim-10-scripts",
      "topic": "project-understanding",
      "status": "verified",
      "statement": "Top-level project boundary containing 12 scanned files.",
      "evidence": [
        "scripts/adoption-evidence.mjs"
      ]
    },
    {
      "id": "claim-11-templates",
      "topic": "project-understanding",
      "status": "verified",
      "statement": "Top-level project boundary containing 34 scanned files.",
      "evidence": [
        "templates/project/.editorconfig"
      ]
    },
    {
      "id": "claim-12-tests",
      "topic": "project-understanding",
      "status": "verified",
      "statement": "Top-level project boundary containing 13 scanned files.",
      "evidence": [
        "tests/adoption-rerun.test.mjs"
      ]
    },
    {
      "id": "claim-13-md",
      "topic": "project-understanding",
      "status": "verified",
      "statement": "111 scanned files use this extension.",
      "evidence": [
        ".github/copilot-instructions.md"
      ]
    },
    {
      "id": "claim-14-json",
      "topic": "project-understanding",
      "status": "verified",
      "statement": "95 scanned files use this extension.",
      "evidence": [
        ".azure/environment.json"
      ]
    },
    {
      "id": "claim-15-mjs",
      "topic": "project-understanding",
      "status": "verified",
      "statement": "34 scanned files use this extension.",
      "evidence": [
        ".github/skills/agent-builder/scripts/agent-builder.mjs"
      ]
    },
    {
      "id": "claim-16-mp3",
      "topic": "project-understanding",
      "status": "verified",
      "statement": "22 scanned files use this extension.",
      "evidence": [
        "Demo/audio/narration/scene-01.mp3"
      ]
    },
    {
      "id": "claim-17-ps1",
      "topic": "project-understanding",
      "status": "verified",
      "statement": "10 scanned files use this extension.",
      "evidence": [
        ".github/skills/agent-builder/scripts/azure-context.ps1"
      ]
    },
    {
      "id": "claim-18-svg",
      "topic": "project-understanding",
      "status": "verified",
      "statement": "8 scanned files use this extension.",
      "evidence": [
        "reports/project-video/source/scene-01.svg"
      ]
    },
    {
      "id": "claim-19-yml",
      "topic": "project-understanding",
      "status": "verified",
      "statement": "3 scanned files use this extension.",
      "evidence": [
        ".github/dependabot.yml"
      ]
    },
    {
      "id": "claim-20-toml",
      "topic": "project-understanding",
      "status": "verified",
      "statement": "2 scanned files use this extension.",
      "evidence": [
        ".github/skills/audit-code/config/gitleaks.toml"
      ]
    },
    {
      "id": "claim-21-yaml",
      "topic": "project-understanding",
      "status": "verified",
      "statement": "2 scanned files use this extension.",
      "evidence": [
        "config/orchestrator.yaml"
      ]
    },
    {
      "id": "claim-22-html",
      "topic": "project-understanding",
      "status": "verified",
      "statement": "2 scanned files use this extension.",
      "evidence": [
        "Demo/project-skills-orchestrator-animation.html"
      ]
    },
    {
      "id": "claim-23-jsonl",
      "topic": "project-understanding",
      "status": "verified",
      "statement": "2 scanned files use this extension.",
      "evidence": [
        "reports/execution-log.jsonl"
      ]
    },
    {
      "id": "claim-24-pptx",
      "topic": "project-understanding",
      "status": "verified",
      "statement": "1 scanned files use this extension.",
      "evidence": [
        "Demo/Project-Orchestrator-Demo.pptx"
      ]
    },
    {
      "id": "claim-25-npm-run-check",
      "topic": "project-understanding",
      "status": "verified",
      "statement": "node --check pso.mjs && npm run security && npm run release && npm run release:verify:candidate && node --test tests/skill-contracts.test.mjs tests/agent-builder.test.mjs tests/audit-assurance.test.mjs tests/audit-execution.test.mjs tests/adoption-rerun.test.mjs tests/security-fuzz.test.mjs tests/production-gates.test.mjs tests/package-install.test.mjs tests/project-understanding.test.mjs tests/documentation-builder.test.mjs tests/project-status.test.mjs tests/project-video.test.mjs && node pso.mjs verify",
      "evidence": [
        "package.json"
      ]
    },
    {
      "id": "claim-26-npm-run-evidence-adoption",
      "topic": "project-understanding",
      "status": "verified",
      "statement": "node scripts/adoption-evidence.mjs",
      "evidence": [
        "package.json"
      ]
    },
    {
      "id": "claim-27-npm-run-inventory",
      "topic": "project-understanding",
      "status": "verified",
      "statement": "node pso.mjs inventory --root .",
      "evidence": [
        "package.json"
      ]
    },
    {
      "id": "claim-28-npm-run-release",
      "topic": "project-understanding",
      "status": "verified",
      "statement": "node scripts/build-release.mjs",
      "evidence": [
        "package.json"
      ]
    },
    {
      "id": "claim-29-npm-run-release-status",
      "topic": "project-understanding",
      "status": "verified",
      "statement": "node scripts/release-status.mjs",
      "evidence": [
        "package.json"
      ]
    },
    {
      "id": "claim-30-npm-run-release-verify",
      "topic": "project-understanding",
      "status": "verified",
      "statement": "node scripts/verify-release.mjs",
      "evidence": [
        "package.json"
      ]
    },
    {
      "id": "claim-31-npm-run-release-verify-candidate",
      "topic": "project-understanding",
      "status": "verified",
      "statement": "node scripts/verify-release.mjs --candidate",
      "evidence": [
        "package.json"
      ]
    },
    {
      "id": "claim-32-npm-run-security",
      "topic": "project-understanding",
      "status": "verified",
      "statement": "node scripts/security-check.mjs",
      "evidence": [
        "package.json"
      ]
    },
    {
      "id": "claim-33-npm-run-security-gitleaks",
      "topic": "project-understanding",
      "status": "verified",
      "statement": "node .github/skills/audit-code/scripts/gitleaks-scan.mjs scan",
      "evidence": [
        "package.json"
      ]
    },
    {
      "id": "claim-34-npm-run-security-gitleaks-install",
      "topic": "project-understanding",
      "status": "verified",
      "statement": "node .github/skills/audit-code/scripts/gitleaks-scan.mjs install",
      "evidence": [
        "package.json"
      ]
    },
    {
      "id": "claim-35-npm-run-test",
      "topic": "project-understanding",
      "status": "verified",
      "statement": "node --test tests/skill-contracts.test.mjs tests/agent-builder.test.mjs tests/audit-assurance.test.mjs tests/audit-execution.test.mjs tests/adoption-rerun.test.mjs tests/security-fuzz.test.mjs tests/production-gates.test.mjs tests/package-install.test.mjs tests/project-understanding.test.mjs tests/documentation-builder.test.mjs tests/project-status.test.mjs tests/project-video.test.mjs",
      "evidence": [
        "package.json"